id,type,judul,tanggal,kategori,deskripsi,url_gambar,url_link,bahan,langkah
1,resep_minuman,Cara Bikin Minuman Hangat untuk Atasi Kedinginan Saat Musim Hujan,27-Oktober-2025,resep_minuman,Udara dingin sering kali membuat tubuh rentan masuk angin hingga flu dan meriang.,"https://asset.kompas.com/crops/e4g7cwD5mIYcCvQDbLMqHPcaXw8=/15x0:556x361/780x390/filters:watermark(data/photo/2020/03/10/5e6775dc18fcf.png,0,-0,1)/data/photo/2023/04/26/6448f24d18101.jpg",https://www.kompas.com/food/read/2025/10/27/101000875/cara-bikin-minuman-hangat-untuk-atasi-kedinginan-saat-musim-hujan,"2 sdt daun basil segar, cincang | 1/2 sdt jahe parut | 1 jari kayu manis | 2-3 butir cengkih | 250 ml air mendidih | 1/2 sdm madu","Seduh basil, jahe, kayu manis, dan cengkih menggunakan air mendidih di dalam cangkir yang tertutup rapat selama 5-10 menit. | Saring dan aduk rata bahan dengan madu. Sajikan."
2,resep_minuman,"Cara Membuat Air Rebusan Jahe 3 Bahan, Minuman Herbal Pagi Hari Ampuh Jaga Imunitas",6-Oktober-2025,resep_minuman,Jahe dikenal sebagai bahan dapur dengan khasiat menghangatkan tubuh dan memperkuat daya tahan.,"https://asset.kompas.com/crops/wvyHoGVfnMDMinLou4OBjhrgu5I=/0x0:1000x667/780x390/filters:watermark(data/photo/2020/03/10/5e6775dc18fcf.png,0,-0,1)/data/photo/2021/09/21/6149c1ca5c443.jpg",https://www.kompas.com/food/read/2025/10/06/120300975/cara-membuat-air-rebusan-jahe-3-bahan-minuman-herbal-pagi-hari-ampuh-jaga,"1 ruas jahe (kupas, geprek) | 500 ml air panas | 1 sdm madu atau gula pasir (sesuai selera)","Siapkan gelas bersih, masukkan jahe yang sudah digeprek. | Tuang air panas ke dalam gelas, aduk perlahan. | Tambahkan madu atau gula pasir, aduk hingga larut. | Diamkan sebentar hingga hangat, lalu minum selagi segar."
3,resep_minuman,"Cara Racik Air Rebusan Serai, Minuman Hangat Pancaroba Baik Diminum Saat Perut Kosong",6-Oktober-2025,resep_minuman,"Saat cuaca tidak menentu seperti ini, minuman hangat bisa menjadi pilihan terbaik untuk menjaga daya tahan tubuh. Salah satunya adalah air rebusan serai, minuman tradisional yang mudah dibuat dan punya aroma segar menenangkan.","https://asset.kompas.com/crops/XM8sVdFvcalOHa_bgg5IedCx8kw=/0x0:1500x1000/780x390/filters:watermark(data/photo/2020/03/10/5e6775dc18fcf.png,0,-0,1)/data/photo/2025/05/22/682f1d38f1771.jpg",https://www.kompas.com/food/read/2025/10/06/110300575/cara-racik-air-rebusan-serai-minuman-hangat-pancaroba-baik-diminum-saat,"4 batang serai, ambil bagian batangnya saja | 750 ml air | 3 lembar daun jeruk | Gula batu, gula aren, atau gula pasir secukupnya","Memarkan bagian bawah batang serai agar aromanya lebih keluar. | Rebus air hingga mendidih, lalu masukkan serai dan daun jeruk. | Biarkan mendidih selama 10 menit hingga air berubah warna kekuningan dan beraroma wangi. | Matikan api, tambahkan gula batu atau gula aren sesuai selera, aduk rata. | Sajikan selagi hangat. | Gunakan serai segar. Serai yang masih hijau dan harum menghasilkan cita rasa lebih kuat dibanding serai kering. | Jangan merebus terlalu lama. Cukup 10–12 menit agar aroma serai tidak hilang dan rasanya tidak pahit. | Tambahkan madu setelah hangat. Jika ingin rasa manis alami, madu bisa menjadi pengganti gula batu, tetapi sebaiknya ditambahkan setelah suhu air turun agar kandungan nutrisinya tidak rusak. | Bisa disimpan di kulkas. Air rebusan serai dapat disimpan di dalam botol tertutup dan tahan hingga 2 hari di lemari es. Hangatkan kembali sebelum diminum."
4,resep_minuman,"Resep Moktail Kopi Rujak, Minuman Segar untuk Cuaca Panas",26-Agustus-2025,resep_minuman,"Kreasi minuman dingin dari Nespresso ini menggunakan kopi arabika asal Sumatera, disajikan dengan sirup rasa buah tropis dari Monin.","https://asset.kompas.com/crops/-q5kIGtRIaa3VMs6QZnhQKz3TqU=/139x0:1219x720/780x390/filters:watermark(data/photo/2020/03/10/5e6775dc18fcf.png,0,-0,1)/data/photo/2025/08/25/68ac7397393e8.jpg",https://www.kompas.com/food/read/2025/08/26/133112575/resep-moktail-kopi-rujak-minuman-segar-untuk-cuaca-panas,40 ml kopi Nespresso varian Indonesia | 7 ml sirup Monin Tropical Island | 50 ml air tonik | Es batu secukupnya | Jeruk kering untuk hiasan | Biji cabai kering (chili flakes) secukupnya,Tuangkan sirup ke dalam gelas. | Tambahkan es batu dan tuangkan air tonik ke dalam gelas. | Seduh kopi dan tuang ke dalam gelas. | Sajikan dengan hiasan jeruk kering dan cabai kering.
5,resep_minuman,"Resep Jus Apel Wortel, Minuman Penangkal Flu Saat Cuaca Tak Menentu",2-Juli-2025,resep_minuman,Flu atau influenza mudah menular melalui virus saat seseorang berkontak langsung dengan mereka yang sedang bersin maupun batuk.,"https://asset.kompas.com/crops/nM5MG1cYXcpzYiFgNORUi_nlfz0=/0x185:667x630/780x390/filters:watermark(data/photo/2020/03/10/5e6775dc18fcf.png,0,-0,1)/data/photo/2025/07/02/68641f5bc0914.jpg",https://www.kompas.com/food/read/2025/07/02/054922175/resep-jus-apel-wortel-minuman-penangkal-flu-saat-cuaca-tak-menentu,"1 buah apel | 1 buah wortel | 100 ml susu cair | 1 sdt kacang brasil, cincang kasar","Masukkan apel, wortel, dan susu ke dalam blender. Proses hingga halus. | Tuang ke dalam gelas, taburi cincangan kacang. Hidangkan segera."
6,resep_minuman,Resep Teh Lemon 4 Bahan untuk Hangatkan Badan Saat Cuaca Dingin,1-Juli-2025,resep_minuman,Tambahan perasan lemon dapat meningkatkan cita rasa teh hangat menjadi lebih segar saat diminum.,"https://asset.kompas.com/crops/ytSaui0qeGL3jeajB8KiLsbhUio=/101x66:899x599/780x390/filters:watermark(data/photo/2020/03/10/5e6775dc18fcf.png,0,-0,1)/data/photo/2022/09/29/633577195127d.jpg",https://www.kompas.com/food/read/2025/07/01/123100775/resep-teh-lemon-4-bahan-untuk-hangatkan-badan-saat-cuaca-dingin,3 sdm teh hitam atau 3 kantong teh celup | 3 buah jeruk lemon | 250 gr gula pasir atau secukupnya | 500 ml air,"Masak air hingga mendidih. Seduh teh hingga berwarna kecoklatan dan saring. | Ambil dua buah jeruk lemon, lalu peras dan saring airnya. Masukkan air jeruk ke dalam air teh yang sudah disaring dan tambahkan gula. | Bila suka, iris tipis jeruk lemon dan tambahkan ke dalam seduhan teh. | Sajikan dalam gelas dan nikmati selagi hangat."
7,resep_minuman,"Cara Membuat Kunyit Asam, Minuman Penjaga Imun Tubuh saat Pancaroba",17-Juni-2025,resep_minuman,"""Kunyit asam menyehatkan karena berfungsi sebagai antiseptik, anti-peradangan sel, dan antioksidan sehingga mampu memperkuat sistem kekebalan,"" tulis Endang S. Sunaryo dalam karya bukunya berjudul ""Minuman Tradisional Penguat Kekebalan Tubuh"" (2015) terbitan Elex Media Komputindo.","https://asset.kompas.com/crops/rrJEM-OMY6wJvuSnQLDGpFacOxM=/24x0:867x562/780x390/filters:watermark(data/photo/2020/03/10/5e6775dc18fcf.png,0,-0,1)/data/photo/2021/03/02/603e41b8eaf6b.jpg",https://www.kompas.com/food/read/2025/06/17/173000075/cara-membuat-kunyit-asam-minuman-penjaga-imun-tubuh-saat-pancaroba,600 gr kunyit tua | 200 gr asam jawa tanpa biji | 50 gr daun asam muda | 10 lembar daun cengkih | 5 buah jeruk nipis | 600 gr gula aren | Garam secukupnya | 2 liter air,"Kupas kunyit, lalu tumbuk bersama daun asam hingga benar-benar halus dan lembut. Tambahkan satu liter air matang sambil diaduk, lalu saring hingga menjadi sari kunyit daun asam. | Larutkan asam dengan 500 mililiter air, lalu saring menjadi sari asam. | Didihkan sari kunyit daun asam dan sari asam bersama sisa air, daun cengkih, dan gula aren. | Masukkan perasan jeruk nipis untuk menambah rasa dan warna cerah pada kunyit asam, serta garam agar rasanya seimbang. Sajikan kunyit asam."
8,resep_minuman,"Resep Wedang Serai Sederhana, Minuman Hangat Praktis Cukup 4 Bahan",22-Mei-2025,resep_minuman,"""Wedang serai telah dikenal lama di masyarakata, biasanya dicampur dengan seduhan teh,"" bunyi pernyataan dari buku ""Dari Bir Jawa Sampai Wedang Uwuh - 26 Minuman Tradisional Khas Yogyakarta"" karya Murdjiati Gardjito dan Retnosyari Septiyani (2018) terbitan CV Penerbit ANDI.","https://asset.kompas.com/crops/XM8sVdFvcalOHa_bgg5IedCx8kw=/0x0:1500x1000/780x390/filters:watermark(data/photo/2020/03/10/5e6775dc18fcf.png,0,-0,1)/data/photo/2025/05/22/682f1d38f1771.jpg",https://www.kompas.com/food/read/2025/05/22/195912475/resep-wedang-serai-sederhana-minuman-hangat-praktis-cukup-4-bahan,"300 mililiter air | 3 batang serai (memarkan) | 3 lembar daun jeruk | Gula batu, gula batu, atau gula pasir secukupnya","Tuang air ke panci, didihkan. Masukkan serai dan daun jeruk, masak dan rebus sekitar 10 menit. | Beri gula, aduk sampai gula larut. Tuang ke gelas saji, hidangkan."
9,resep_minuman,"Resep Jus Jeruk Aroma Jahe, Minuman Segar untuk Cuaca Panas",25-April-2025,resep_minuman,"Simak resep dan cara membuat jus jeruk aroma jahe, dilansir dari laman Sajian Sedap, Jumat (25/4/2025).","https://asset.kompas.com/crops/P3KGCP5IwXCXFHQ72a9t0o4fVU4=/0x0:698x465/780x390/filters:watermark(data/photo/2020/03/10/5e6775dc18fcf.png,0,-0,1)/data/photo/2025/04/25/680aff93250b9.jpg",https://www.kompas.com/food/read/2025/04/25/103211175/resep-jus-jeruk-aroma-jahe-minuman-segar-untuk-cuaca-panas,6 buah jeruk medan (peras) | 2 sendok makan air jahe | 300 mililiter air | 200 gram es batu | 100 gram gula pasir | 100 mililiter air,"Sirop. Masukkan gula pasir dan air ke dalam panci, masak sampai mendidih lalu dinginkan. | Campurkan sirop dengan bahan-bahan jus jeruk ke dalam gelas saji. Tambahkan es batu, lalu sajikan."
10,resep_minuman,"Resep Lime Blush Punch, Ide Minuman untuk Buka Puasa",21-Maret-2025,resep_minuman,"Rasa asam dari air jeruk nipis, ditambah soda yang memberi sensasi ""pedas"" di lidah dan sirop grenadine yang manis membuat minuman ini cocok disantap bersama keluarga.","https://asset.kompas.com/crops/G4ER0IuG53_vr8qrBJLbARjIgjQ=/0x0:698x465/780x390/filters:watermark(data/photo/2020/03/10/5e6775dc18fcf.png,0,-0,1)/data/photo/2025/03/21/67dd4f49ee0e5.jpg",https://www.kompas.com/food/read/2025/03/21/184500175/resep-lime-blush-punch-ide-minuman-untuk-buka-puasa,60 mililiter sirop grenadine | 50 mililiter air jeruk nipis | 2 kaleng soda manis dingin | 100 gram irisan jeruk nipis (untuk penyajian) | 150 gram es batu (untuk penyajian),"Campurkan sirop grenadine dan jeruk nipis, aduk sampai rata. | Tuang ke gelas saji, tambahkan irisan jeruk nipis, es batu, dan soda. Sajikan."
11,resep_minuman,Resep Es Buah Segar Tanpa Susu dan Sirup untuk Buka Puasa,1-Maret-2025,resep_minuman,Hanya membutuhkan tiga jenis buah dan sirup gula (simple syrup) untuk membuat es buah segar.,"https://asset.kompas.com/crops/aaFpoH1KUshqAu5WLWCd5G0tEEg=/110x73:837x558/780x390/filters:watermark(data/photo/2020/03/10/5e6775dc18fcf.png,0,-0,1)/data/photo/2022/05/02/626f40abc96f9.jpg",https://www.kompas.com/food/read/2025/03/01/163100375/resep-es-buah-segar-tanpa-susu-dan-sirup-untuk-buka-puasa,"300 gr pepaya | 300 gr melon | 300 gr semangka | 250 gr gula pasir | 50 ml air | 1 buah jeruk lemon, peras airnya","Potong daging buah pepaya, melon, dan semangka dengan alat pemotong buah berbentuk bulat kecil. Simpan di kulkas. | Buat sirup dengan mendidihkan gula, air, dan air jeruk lemon hingga mengental. Angkat dan dinginkan. Simpan di kulkas. | Setelah buah dan sirup dingin, campur, dan aduk rata. Siapkan gelas, tuangkan ke dalamnya dan sajikan dingin."
12,resep_minuman,"Resep Es Tape Singkong Mutiara, Takjil untuk Bukber Keluarga",19-Februari-2025,resep_minuman,"Perpaduan tape singkong yang lembut, sagu mutiara kenyal, dan santan gurih berpadu dengan es serut menyegarkan, cocok disantap bersama keluarga saat momen bukber.","https://asset.kompas.com/crops/W7lLCRoki6DDuNw9ynjue0zMaGQ=/55x28:935x615/780x390/filters:watermark(data/photo/2020/03/10/5e6775dc18fcf.png,0,-0,1)/data/photo/2024/04/10/6616bbe543b00.jpg",https://www.kompas.com/food/read/2025/02/19/130100775/resep-es-tape-singkong-mutiara-takjil-untuk-bukber-keluarga,"250 gram tape siap pakai | 150 gram sagu mutiara (rendam 30 menit, lalu tiriskan) | 250 mililiter santan | 2 lembar daun pandan | 100 gram gula pasir | Es serut secukupnya | 5 Cara Merebus Singkong agar Empuk, Bahan Takjil Buka Puasa","Rebus sagu mutiara dengan 250 mililiter air, beri daun pandan dan gula pasir, lalu masak sembari diaduk hingga gula larut sekitar 20 menit. Setelah itu angkat dan tiriskan. | Potong-potong tape singkong lalu taruh di dalam mangkuk, siram tape singkong dengan sagu mutiara. | Rebus santan dan gula pasir di dalam panci sampai mendidih kemudian angkat dan biarkan dingin. | Siapkan mangkuk, isi dengan tape singkong, sagu mutiara, dan es serut, lalu tuang santan di atasnya saat hendak disajikan."
13,resep_minuman,"Resep Es Kelapa Jeruk, Minuman Segar Dingin untuk Buka Puasa",17-Februari-2025,resep_minuman,"Es kelapa jeruk menggabungkan kesegaran air jeruk peras dengan tekstur lembut kelapa muda, menciptakan minuman yang sempurna untuk melepas dahaga saat berbuka puasa.","https://asset.kompas.com/crops/GBg-8yRsESgf0v0Z9wZDxcFO2ZU=/0x0:1000x667/780x390/filters:watermark(data/photo/2020/03/10/5e6775dc18fcf.png,0,-0,1)/data/photo/2023/10/24/6536a69f1f0e0.jpg",https://www.kompas.com/food/read/2025/02/17/184959575/resep-es-kelapa-jeruk-minuman-segar-dingin-untuk-buka-puasa,"10 buah jeruk peras (belah 2, peras, dan saring) | 1 buah kelapa muda (serut memanjang) | 100 gram gula pasir | 300 mililiter air matang dingin | Es serut secukupnya | 10 Resep Es Buah Segar untuk Menu Buka Puasa, Simpel dan Lezat","Campur perasan jeruk, gula pasir, dan 300 mililiter air dingin, kemudian aduk hingga merata. Sementara itu, siapkan lima gelas saji. | Isi setiap gelas dengan serutan kelapa muda hingga 1/3 bagian gelas, tambahkan es batu, lalu tuang campuran air jeruk sesaat sebelum disajikan."
14,resep_minuman,"Resep Cokelat Dingin dengan Jeli, Ide Minuman Valentine yang Segar",3-Februari-2025,resep_minuman,"Bahan-bahan yang diperlukan tak terlalu banyak, antara lain susu cair, kental manis cokelat, cokelat masak, dan es batu.","https://asset.kompas.com/crops/_lGeZ9-eiSdzlxPPOgnIv0HI-As=/0x0:697x465/780x390/filters:watermark(data/photo/2020/03/10/5e6775dc18fcf.png,0,-0,1)/data/photo/2025/02/02/679f815f8fee4.jpg",https://www.kompas.com/food/read/2025/02/03/063600475/resep-cokelat-dingin-dengan-jeli-ide-minuman-valentine-yang-segar,200 mililiter susu cair | 200 mililiter kental manis cokelat | 100 gram cokelat masak pekat | 500 gram es batu | 1 bungkus jeli bubuk | 100 gram gula pasir | 500 mililiter air,"Jeli. Masukkan jeli bubuk, gula pasir, dan air ke panci. Masak sembari diaduk sampai mendidih. Kemudian tuang campuran jeli ke dalam loyang, lalu biarkan dingin sebelum dipotong dadu. | Minuman cokelat. Campur susu air dan kental manis cokelat ke panci. Masak sembari diaduk sampai panas, selanjutnya tambahkan cokelat masak. Aduk dan masak kembali sampai bahan-bahan tercampur rata. Diamkan sampai bersuhu ruang. | Pindahkan minuman cokelat ke blender, lalu beri es batu. Haluskan sampai lembut atau sesuai selera. Tambahkan jeli sebelum disajikan."
15,resep_minuman,"Resep Olahan Rambutan, Bisa Dibuat Jadi Minuman Dingin",1-Februari-2025,resep_minuman,"Kamu bisa menggunakan buah rambutan segar, tapi pastikan biji dan daging buah sudah terpisah. Jika tak ada, gunakanlah rambutan kalengan.","https://asset.kompas.com/crops/cUxsr9ywlZg3euh42pqCljv2Z8M=/0x0:697x465/780x390/filters:watermark(data/photo/2020/03/10/5e6775dc18fcf.png,0,-0,1)/data/photo/2025/02/01/679dae33c7d00.jpg",https://www.kompas.com/food/read/2025/02/01/123215875/resep-olahan-rambutan-bisa-dibuat-jadi-minuman-dingin,1 kaleng rambutan kaleng (tiriskan airnya) | 300 mililiter air rambutan kaleng | 200 mililiter air matang | 500 gram es serut | 500 mililiter susu cair | 1/2 bungkus agar-agar | 50 gram gula pasir | 1/4 sendok teh essence almond | 100 mililiter air | 175 gram gula pasir,"Puding. Campurkan susu cair, agar-agar dan gula pasir ke panci. Masak sembari diaduk hingga mendidih. Beri essence almond, angkat kemudian pindahkan campuran ke loyang berukuran 16 x 16 x 5 sentimeter. Biarkan dingin. | Setelah adonan dingin, potong dadu seukuran 2 x 2 sentimeter. Diamkan. | Sirop. Campurkan air dan gula ke panci, masak dan aduk sampai mendidih. Biarkan dingin. | Es rambutan. Masukkan rambutan, air rambutan, air, sirop, dan puding ke dalam wadah. Aduk sampai rata. Hidangkan dengan tambahan es serut."
16,resep_minuman,"Resep Teh Tarik, Minuman Hangat dan Manis untuk Cuaca Hujan",31-Januari-2025,resep_minuman,Kamu bisa mencampur teh dan susu evaporasi tanpa tambahan gula atau menggantinya dengan kental manis.,"https://asset.kompas.com/crops/pQC8t-ZQeOywcoQ3flwS-g2T4D4=/47x121:927x708/780x390/filters:watermark(data/photo/2020/03/10/5e6775dc18fcf.png,0,-0,1)/data/photo/2025/01/31/679c2a6464d44.jpg",https://www.kompas.com/food/read/2025/01/31/122500475/resep-teh-tarik-minuman-hangat-dan-manis-untuk-cuaca-hujan,2 sdt teh hitam aroma melati | 200 ml air mendidih | 50 ml susu evaporasi | 3 sdm kental manis,"Siapkan satu gelas bergagang, seduh teh dengan air panas mendidih hingga kental dan hitam. | Tambahkan susu evaporasi dan kental manis. Aduk rata. | Siapkan gelas kosong bergagang. Tuang campuran teh susu ke dalam gelas kosong sambil ditarik agak tinggi hingga seperti air yang akan tumpah. Lakukan berulang-ulang sampai berbusa. | Sajikan teh tarik selagi hangat."
17,resep_minuman,Cara Membuat Jus Sehat Penambah Imun Tubuh,31-Januari-2025,resep_minuman,"Jeruk, jahe, dan kunyit, pembangkit sistem imun yang populer, disatukan untuk membuat jus yang lezat dan sehat.","https://asset.kompas.com/crops/NLDiIlm_7hmALTjxThuZnpY-30o=/0x12:1000x678/780x390/filters:watermark(data/photo/2020/03/10/5e6775dc18fcf.png,0,-0,1)/data/photo/2024/01/10/659e57b6ab3df.jpg",https://www.kompas.com/food/read/2025/01/31/093100075/cara-membuat-jus-sehat-penambah-imun-tubuh,"1 (5 cm) jahe segar | 1 (3,8 cm) buah kunyit segar | 3 jeruk sunkist besar, kupas | Es batu","Proses jahe, kunyit, dan jeruk di blender atau juicer, sesuai urutan yang tercantum. Tuang di atas es dan segera minum. | Jika memakai blender saring terlebih dahulu."
18,resep_minuman,"Resep Jus Tomat Lemon, Minuman Penurun Kadar Asam Urat",26-Januari-2025,resep_minuman,"Sebaliknya, pengidap asam urat mesti mengonsumsi bahan makanan rendah purin untuk menurunkan kadar asam urat.","https://asset.kompas.com/crops/FjMKJJ_Is-w2W1PMQadyATs-FFw=/0x35:612x443/780x390/filters:watermark(data/photo/2020/03/10/5e6775dc18fcf.png,0,-0,1)/data/photo/2023/08/17/64ddaa3163e94.jpeg",https://www.kompas.com/food/read/2025/01/26/141413375/resep-jus-tomat-lemon-minuman-penurun-kadar-asam-urat,150 gr tomat | 1 sdm air jeruk lemon | 150 ml air matang | 50 gr es batu,Blender semua bahan sampai lembut. | Tuang dalam gelas saji. Minum selagi dingin.
19,resep_minuman,"Resep Mocktail untuk Imlek 2025, Cuma Butuh 4 Bahan",24-Januari-2025,resep_minuman,"Kali ini kamu cuma perlu empat bahan, dan cara membuatnya pun mudah ditiru dirumah.","https://asset.kompas.com/crops/IVrCADKzPKyF2KK5hVCu2dw78t4=/0x1925:3456x4229/780x390/filters:watermark(data/photo/2020/03/10/5e6775dc18fcf.png,0,-0,1)/data/photo/2022/11/23/637dc6916002f.jpg",https://www.kompas.com/food/read/2025/01/24/163100975/resep-mocktail-untuk-imlek-2025-cuma-butuh-4-bahan,1 sendok makan gula pasir | Seikat daun mint | 3 buah jeruk nipis | Air soda,"Haluskan gula dan daun mint secara bersamaan kemudian sisihkan. Masukkan es serut ke dalam dua gelas, lalu tuang air jeruk nipis ke dalam gelas bersama campuran daun mint. | Tuang air soda ke dalam gelas sesaat sebelum disajikan."
20,resep_minuman,"Resep Wedang Uwuh, Minuman Hangat untuk Cuaca Dingin",22-Januari-2025,resep_minuman,"Manfaat wedang berbeda-beda, tergantung bahan utama yang digunakan dalam minuman hangat tersebut.","https://asset.kompas.com/crops/izvLbT7xEkO-SjMR0CRTb70JHLM=/0x0:1000x667/780x390/filters:watermark(data/photo/2020/03/10/5e6775dc18fcf.png,0,-0,1)/data/photo/2020/03/25/5e7b041541317.jpg",https://www.kompas.com/food/read/2025/01/22/092300075/resep-wedang-uwuh-minuman-hangat-untuk-cuaca-dingin,1/2-1 jahe merah atau jahe wangi | 2 buah kapulaga | 1-2 lembar daun salam | 1 lembar daun manis jangan | 3-4 serutan kayu secang | 4-6 buah bunga cengkih | 1 potongan kayu akway | Gula batu secukupnya | 150 mililiter air,"Memarkan jahe wangi atau jahe merah, pecahkan kapulaga, lalu masukkan seluruh rempah-rempah ke dalam gelas dan seduh dengan 150 mililiter air mendidih. | Biarkan selama 5-10 menit, lalu minum."
21,resep_minuman,"Resep Minuman Penurun Kolesterol, Smoothie Stroberi Oatmeal",2-Januari-2025,resep_minuman,"Dikutip dari Medical News Today, Rabu (2/1/2025), buah beri kaya akan antioksidan dan serat sehingga bisa membantu menurunkan kolesterol, sekaligus rendah lemak dan kalori.","https://asset.kompas.com/crops/_1uvCWH8DwDzoV5RaRNKVjDDuFE=/0x0:1000x667/780x390/filters:watermark(data/photo/2020/03/10/5e6775dc18fcf.png,0,-0,1)/data/photo/2020/07/31/5f2418fef23ef.jpg",https://www.kompas.com/food/read/2025/01/02/102411475/resep-minuman-penurun-kolesterol-smoothie-stroberi-oatmeal,125 gram bluberi beku | 5 buah stroberi besar | 180 mililiter susu skim | 100 gram gula pasir | 100 gram oatmeal | 60 gram greek yoghurt | Es batu secukupnya,"Campur bluberi, susu, gula, oatmeal, stroberi, dan yogurt dalam blender, haluskan. | Tambahkan es, blender kembali hingga halus."
22,resep_minuman,"Resep Kopi Jahe Pedas, Minuman Penghangat Tubuh",15-Desember-2024,resep_minuman,"Kamu bisa membuat kopi jahe pedas yang terbuat dari jahe, serai, kental manis, gula, kopi bubuk, dan air.","https://asset.kompas.com/crops/4MxX-H-PjMhiuSPH1Zg2_9CuVKc=/0x0:1000x667/780x390/filters:watermark(data/photo/2020/03/10/5e6775dc18fcf.png,0,-0,1)/data/photo/2024/11/20/673d3f280a87a.jpg",https://www.kompas.com/food/read/2024/12/15/070300775/resep-kopi-jahe-pedas-minuman-penghangat-tubuh,"200 gram jahe | 5 barang serai, memarkan | 175 gram gula pasir | 1.250 ml air | Kental manis secukupnya | 3 sdm kopi bubuk | Kopi Geisha Termahal di Dunia, Apa Alasannya?","Garang atau bakar jahe sampai layu dan berair, kemudian pukul-pukul sampai memar. | Masak jahe, serai, kopi bubuk, gula pasir, dan air sampai mendidih dan air sampai mendidih dan air berkurang. Angkat dan saring. Panaskan kembali sampai mendidih. | Tuang kental manis, aduk rata. Sajikan dalam keadaan panas."
23,resep_minuman,"Resep Teh Madu Jeruk Nipis, Ide Minuman Hangat dan Segar",9-Desember-2024,resep_minuman,"Rasa teh ini tidak hanya asam menyegarkan, tapi juga manis berkat madu yang ditambahkan saat disajikan ke cangkir saji.","https://asset.kompas.com/crops/noFTFBHnkqfecDTVjtZac8Z_Juo=/684x456:6160x4107/780x390/filters:watermark(data/photo/2020/03/10/5e6775dc18fcf.png,0,-0,1)/data/photo/2024/09/28/66f7c1590a704.jpg",https://www.kompas.com/food/read/2024/12/09/143400575/resep-teh-madu-jeruk-nipis-ide-minuman-hangat-dan-segar,2 sendok makan teh hitam atau 2 kantong teh celup | 2 buah jeruk nipis (peras airnya) | 750 mililiter air | 100 mililiter madu,"Panaskan air di panci sampai mendidih, beri teh hitam atau teh celup. Tuang air perasan jeruk nipis dan diamkan selama beberapa saat sampai warnanya kecoklatan. Angkat, kemudian saring. | Tuang campuran teh dan jeruk nipis tersebut ke cangkir saji, beri madu agar manis."
24,resep_minuman,"Cara Membuat Teh Tubruk Madu, Minuman Hangat Saat Hujan",2-Desember-2024,resep_minuman,Jika kehujanan saat pulang kerja segera siapkan minuman hangat untuk memberikan rasa nyaman di badan.,"https://asset.kompas.com/crops/_YqrshkCtTlulNk09QHsuRIM8m8=/62x0:740x452/780x390/filters:watermark(data/photo/2020/03/10/5e6775dc18fcf.png,0,-0,1)/data/photo/2024/11/08/672dc8667aefa.jpg",https://www.kompas.com/food/read/2024/12/02/220805475/cara-membuat-teh-tubruk-madu-minuman-hangat-saat-hujan,Teh hitam 1 sendok makan | Madu 5 sendok makan | Air 500 mi,"Masak air sampai mendidih. | Siapkan cangkir dan isi dengan teh hitam, tuang air panas lalu tambahkan madu. Sajikan teh beserta ampasnya agar keharuman tetap terasa."
25,resep_minuman,"Resep Kopi Santan, Minuman Gurih dan Hangat untuk Tubuh",28-November-2024,resep_minuman,Kamu bisa menggunakan kopi instan untuk resep ini. Tambahkan pula garam secukupnya agar rasanya seimbang.,"https://asset.kompas.com/crops/uoWFEQQle1XXtpr8sYcPDu662X0=/0x693:1000x1359/780x390/filters:watermark(data/photo/2020/03/10/5e6775dc18fcf.png,0,-0,1)/data/photo/2024/11/28/6748654507589.jpg",https://www.kompas.com/food/read/2024/11/28/195244075/resep-kopi-santan-minuman-gurih-dan-hangat-untuk-tubuh,2 sdm kopi instan | 4 sdm gula merah | 400 ml santan dari 1/4 butir kelapa | 1 ruas jari jahe | Garam secukupnya,"Masukkan kopi instan dan gula ke cangkir atau gelas. Sisihkan. | Masak santan, jahe, dan garam di panci sampai mendidih sembari diaduk. Tuang campuran ini ke dalam cangkir atau gelas yang sudah terisi kopi instan dan gula. Aduk sampai rata. | Tuang campuran kopi santan ke gelas atau cangkir saji sembari disaring. Sajikan."
26,resep_minuman,"Resep Kopi Ginseng Jahe, Minuman Hangat untuk Jaga Stamina Tubuh",20-November-2024,resep_minuman,Ginseng bermanfaat untuk menjaga stamina tubuh dan mengembalikkan kebugaran badan usai beraktivitas.,"https://asset.kompas.com/crops/4MxX-H-PjMhiuSPH1Zg2_9CuVKc=/0x0:1000x667/780x390/filters:watermark(data/photo/2020/03/10/5e6775dc18fcf.png,0,-0,1)/data/photo/2024/11/20/673d3f280a87a.jpg",https://www.kompas.com/food/read/2024/11/20/093700475/resep-kopi-ginseng-jahe-minuman-hangat-untuk-jaga-stamina-tubuh,1 sdm kopi instan hitam | 3 ruas jari akar ginseng | 1 ruas jari jahe | 2 sdm krimer | 2 sdm gula pasir | 1 sdm madu | 600 ml air,"Cuci jahe, lalu bakar dan memarkan. Masak air hingga mendidih. Masukkan jahe sampai berbau harum, lalu masukkan akar ginseng. | Siapkan cangkir, seduh kopi instan, krimer, dan gula pasir dengan air rebusan jahe serta ginseng. Aduk rata. | Tambahkan madu dan sajikan selagi hangat."
